PSO-ELM: A Hybrid Learning Model for Short-Term Traffic Flow Forecasting,https://webofscience.clarivate.cn/wos/woscc/full-record/WOS:000513491600001,"Cai Weihong, 汕头大学","Yang Junjie, 广东工业大学","Yu Yidan, 深圳大学","Song Youyi, 中国药科大学","Zhou Teng, 海南大学","Qin Jing, 香港理工大学"
A noise-immune Kalman filter for short-term traffic flow forecasting,https://webofscience.clarivate.cn/wos/woscc/full-record/WOS:000500034900038,"Cai Lingru, ","Zhang Zhanchang, 汕头大学","Yang Junjie, 广东工业大学","Yu Yidan, 深圳大学","Zhou Teng, 海南大学","Qin Jing, 香港理工大学"
PwAdaBoost: Possible world based AdaBoost algorithm for classifying uncertain data,https://webofscience.clarivate.cn/wos/woscc/full-record/WOS:000498755600003,"Liu Han, 大连理工大学","Zhang Xianchao, 平顶山市第一人民医院","Zhang Xiaotong, "
A system evaluation of NBA rookie contract execution efficiency with stacked Autoencoder and hybrid DEA,https://webofscience.clarivate.cn/wos/woscc/full-record/WOS:000500848000001,"Zhu Qing, 陕西师范大学","Zuo Renxian, 武汉大学","Li Yuze, 广西大学","Liu Shan, Xi交通大学"
Effective passenger flow forecasting using STL and ESN based on two improvement strategies,https://webofscience.clarivate.cn/wos/woscc/full-record/WOS:000468599800023,"Qin Lan, 三一药品有限公司","Li Weide, 兰州大学","Li Shijia, 赣州医院不是中国医学"
SVRGSA: a hybrid learning based model for short-term traffic flow forecasting,https://webofscience.clarivate.cn/wos/woscc/full-record/WOS:000482448600004,"Cai Lingru, ","Chen Qian, ","Cai Weihong, 汕头大学","Xu Xuemiao, 华南大学科技","Zhou Teng, 海南大学","Qin Jing, 香港理工大学"
Probabilistic deep neural network price forecasting based on residential load and wind speed predictions,https://webofscience.clarivate.cn/wos/woscc/full-record/WOS:000478936200003,"Afrasiabi Mousa, 拉彭兰塔理工大学","Mohammadi Mohammad, ","Rastegar Mohammad, 设拉子大学","Kargarian Amin, 路易斯安那州立大学"
Hybrid dual Kalman filtering model for short-term traffic flow forecasting,https://webofscience.clarivate.cn/wos/woscc/full-record/WOS:000477729700014,"Zhou Teng, 海南大学","Jiang Dazhi, 汕头大学","Lin Zhizhe, ","Han Guoqiang, 东国大学","Xu Xuemiao, 华南大学科技","Qin Jing, 香港理工大学"
Deep Architecture for Citywide Travel Time Estimation Incorporating Contextual Information,https://webofscience.clarivate.cn/wos/woscc/full-record/WOS:000473615000001,"Tang Kun, ","Chen Shuyan, 中国科学技术大学，中国科学院","Khattak Aemal J., 内布拉斯加大学林肯","Pan Yingjiu, 长安大学"
A Learning-Based Multimodel Integrated Framework for Dynamic Traffic Flow Forecasting,https://webofscience.clarivate.cn/wos/woscc/full-record/WOS:000460030700024,"Zhou Teng, 海南大学","Han Guoqiang, 东国大学","Xu Xuemiao, 华南大学科技","Han Chu, ","Huang Yuchang, 长庚医院","Qin Jing, 香港理工大学"
Noise-identified Kalman filter for short-term traffic flow forecasting,https://webofscience.clarivate.cn/wos/woscc/full-record/WOS:000569762200075,"Zhang Shuangyi, 内蒙古农业大学","Song Youyi, 中国药科大学","Jiang Dazhi, 汕头大学","Zhou Teng, 海南大学","Qin Jing, 香港理工大学"
Traffic Flow Prediction during the Holidays Based on DFT and SVR,https://webofscience.clarivate.cn/wos/woscc/full-record/WOS:000469291700001,"Luo Xianglong, 四川大学","Li Danyang, ","Zhang Shengrui, 长安大学"
An Ensemble Model Based on Adaptive Noise Reducer and Over-Fitting Prevention LSTM for Multivariate Time Series Forecasting,https://webofscience.clarivate.cn/wos/woscc/full-record/WOS:000461188000001,"Liu Fagui, 华南理工大学","Cai Muqing, 华南理工大学","Wang Liangming, ","Lu Yunsheng, 台湾农业研究所"
Spatiotemporal Traffic Flow Prediction with KNN and LSTM,https://webofscience.clarivate.cn/wos/woscc/full-record/WOS:000460891500001,"Luo Xianglong, 四川大学","Li Danyang, ","Yang Yu, 长安大学","Zhang Shengrui, 长安大学"
A Novel Online Dynamic Temporal Context Neural Network Framework for the Prediction of Road Traffic Flow,https://webofscience.clarivate.cn/wos/woscc/full-record/WOS:000614765300026,"Bartlett Zoe, 曼彻斯特城市大学","Han Liangxiu, 曼彻斯特城市大学","Nguyen Trung Thanh, 利物浦约翰摩尔大学","Johnson Princy, 利物浦约翰摩尔大学"
Parallel computing method of deep belief networks and its application to traffic flow prediction,https://webofscience.clarivate.cn/wos/woscc/full-record/WOS:000454468200077,"Zhao Lu, 温州职业技术学院","Zhou Yonghua, 北京交通大学","Lu Huapu, 清华大学","Fujita Hamido, Universiti Teknologi Malaysia"
Effective long short-term memory with differential evolution algorithm for electricity price prediction,https://webofscience.clarivate.cn/wos/woscc/full-record/WOS:000447576500102,"Peng Lu, 武汉理工大学","Liu Shan, Xi交通大学","Liu Rui, 深圳理工大学","Wang Lin, 华南科技大学"
Towards investigation of iterative strategy for data mining of short-term traffic flow with Recurrent Neural Networks,https://webofscience.clarivate.cn/wos/woscc/full-record/WOS:000471057400012,"Fandango Armando, Inst模拟和培训","Wiegand R. Paul, 温思罗普大学"
Ensemble Learning Multiple LSSVR With Improved Harmony Search Algorithm for Short-Term Traffic Flow Forecasting,https://webofscience.clarivate.cn/wos/woscc/full-record/WOS:000427574800001,"Chen Xiaobo, 山东工商大学","Cai Xinwen, 陕西师范大学","Liang Jun, 江苏大学","Liu Qingchao, 中国科学院"
